{
  "schema_version": 2,
  "production_id": "PR-018fa2b3-12cd-7abc-8abc-0123456789ab",
  "matter_id": "example-only",
  "created_at": "2026-10-09T20:43:00+09:00",
  "creator": "human:fixture",
  "output_sha256": "5d000b44db178b31c4aca20a5ef5741adb7e14b8297a2139e83f4119c783dd5f",
  "purpose": "fixture",
  "items": [
    {
      "evidence_id": "EV-018fa2b3-12cd-7abc-8abc-0123456789ab",
      "object_sha256": "5d000b44db178b31c4aca20a5ef5741adb7e14b8297a2139e83f4119c783dd5f",
      "output_label": "Appendix 1",
      "representation": "original_copy"
    }
  ]
}
